Key,Item Type,Publication Year,Author,Title,Publication Title,ISBN,ISSN,DOI,Url,Abstract Note,Date,Date Added,Date Modified,Access Date,Pages,Num Pages,Issue,Volume,Number Of Volumes,Journal Abbreviation,Short Title,Series,Series Number,Series Text,Series Title,Publisher,Place,Language,Rights,Type,Archive,Archive Location,Library Catalog,Call Number,Extra,Notes,File Attachments,Link Attachments,Manual Tags,Automatic Tags,Editor,Series Editor,Translator,Contributor,Attorney Agent,Book Author,Cast Member,Commenter,Composer,Cosponsor,Counsel,Interviewer,Producer,Recipient,Reviewed Author,Scriptwriter,Words By,Guest,Number,Edition,Running Time,Scale,Medium,Artwork Size,Filing Date,Application Number,Assignee,Issuing Authority,Country,Meeting Name,Conference Name,Court,References,Reporter,Legal Status,Priority Numbers,Programming Language,Version,System,Code,Code Number,Section,Session,Committee,History,Legislative Body
R76H53XW,journalArticle,2021,"Liang, Jianyu; Terasaki, Koji; Miyoshi, Takemasa",A machine learning approach to the observation operator for satellite radiance data assimilation,,,,,https://ui.adsabs.harvard.edu/abs/2021EGUGA..2310475L,"The ""observation operator"" is essential in data assimilation (DA) to derive the model equivalent of the observations from the model variables. For satellite radiance observations, it is usually based on complex radiative transfer model (RTM) with a bias correction procedure. Therefore, it usually takes time to start using new satellite data after launching the satellites. Here we take advantage of the recent fast development of machine learning (ML) which is good at finding the complex relationships within data. ML can potentially be used as the ""observation operator"" to reveal the relationships between the model variables and the observations without knowing their physical relationships. In this study, we test with the numerical weather prediction system composed of the Nonhydrostatic Icosahedral Atmospheric Model (NICAM) and the Local Ensemble Transform Kalman Filter (LETKF). We focus on the satellite microwave brightness temperature (BT) from the Advanced Microwave Sounding Unit-A (AMSU-A). Conventional observations and AMSU-A data were assimilated every 6 hours. The reference DA system employed the observation operator based on the RTTOV and an online bias correction method.We used this reference system to generate 1-month data to train the machine learning model. Since the reference system includes running a physically-based RTM, we implicitly used the information from RTM for training the ML model in this study, although in our future research we will explore methods without the use of RTM. The machine learning model is artificial neural networks with 5 fully connected layers. The input of the ML model includes the NICAM model variables and predictors for bias correction, and the output of the ML model is the corresponding satellite BT in 3 channels from 5 satellites. Next, we ran the DA cycle for the same month the following year to test the performance of the ML model. Two experiments were conducted. The control experiment (CTRL) was performed with the reference system. In the test experiment (TEST), the ML model was used as the observation operator and there is no separate bias correction procedure since the training includes biased differences between the model and observation. The results showed no significant bias of the simulated BT by the ML model. Using the ECMWF global atmospheric reanalysis (ERA-interim) as a benchmark to evaluate the analysis accuracy, the global-mean RMSE, bias, and ensemble spread for temperature in TEST are 2% higher, 4% higher, and 1% lower respectively than those in CTRL. The result is encouraging since our ML can emulate the RTM. The limitation of our study is that we rely on the physically-based RTM in the reference DA system, which is used for training the ML model. This is the first result and still preliminary. We are currently considering other methods to train the ML model without using the RTM at all.",2021/4/1,2021/12/3 13:08,2021/12/3 13:08,2021/12/3 13:08,EGU21-10475,,,,,,,,,,,,,,,,,,NASA ADS,,Conference Name: EGU General Assembly Conference Abstracts ADS Bibcode: 2021EGUGA..2310475L,,,,,,,,,,,,,,,,,,,,,,,,,,,,,,,,,,,,,,,,,,,,,,,,,,,
AZ4XD7PZ,journalArticle,2019,"Agrawal, Shreya; Barrington, Luke; Bromberg, Carla; Burge, John; Gazen, Cenk; Hickey, Jason",Machine Learning for Precipitation Nowcasting from Radar Images,"arXiv:1912.12132 [cs, stat]",,,,http://arxiv.org/abs/1912.12132,"High-resolution nowcasting is an essential tool needed for effective adaptation to climate change, particularly for extreme weather. As Deep Learning (DL) techniques have shown dramatic promise in many domains, including the geosciences, we present an application of DL to the problem of precipitation nowcasting, i.e., high-resolution (1 km x 1 km) short-term (1 hour) predictions of precipitation. We treat forecasting as an image-to-image translation problem and leverage the power of the ubiquitous UNET convolutional neural network. We find this performs favorably when compared to three commonly used models: optical flow, persistence and NOAA's numerical one-hour HRRR nowcasting prediction.",2019/12/11,2021/12/3 13:08,2021/12/3 13:08,2021/12/3 13:08,,,,,,,,,,,,,,,,,,,arXiv.org,,arXiv: 1912.12132,,/Users/bbochenek/Zotero/storage/XU2B6Q4G/Agrawal et al. - 2019 - Machine Learning for Precipitation Nowcasting from.pdf; /Users/bbochenek/Zotero/storage/ZX3X7MSW/1912.html,,,Computer Science - Computer Vision and Pattern Recognition; Computer Science - Machine Learning; Statistics - Machine Learning,,,,,,,,,,,,,,,,,,,,,,,,,,,,,,,,,,,,,,,,,,,,,,
TFZ58GU2,webpage,2020,"Szunyogh, Istvan; Arcomano, Troy; Pathak, Jaideep; Wikner, Alexander; Hunt, Brian; Ott, Edward",A Machine-Learning-Based Global Atmospheric Forecast Model,Earth and Space Science Open Archive,,,,http://www.essoar.org/doi/10.1002/essoar.10502527.1,The paper investigates the applicability of machine learning (ML) to weather prediction by building a  low-resolution ML model for global weather prediction. The forecast performance of the,2020/3/21,2021/12/3 13:09,2021/12/3 13:09,2021/12/3 13:09,,,,,,,,,,,,,,EN,Creative Commons Attribution 4.0 International License,preprint,,,,,Archive Location: world Publisher: Earth and Space Science Open Archive Section: Atmospheric Sciences DOI: 10.1002/essoar.10502527.1,,,,,,,,,,,,,,,,,,,,,,,,,,,,,,,,,,,,,,,,,,,,,,,,,,,
QS7QUGFC,journalArticle,2021,"Scher, Sebastian; Messori, Gabriele",Ensemble Methods for Neural Network-Based Weather Forecasts,Journal of Advances in Modeling Earth Systems,,1942-2466,10.1029/2020MS002331,https://onlinelibrary.wiley.com/doi/abs/10.1029/2020MS002331,"Ensemble weather forecasts enable a measure of uncertainty to be attached to each forecast, by computing the ensemble's spread. However, generating an ensemble with a good spread-error relationship is far from trivial, and a wide range of approaches to achieve this have been explored—chiefly in the context of numerical weather prediction models. Here, we aim to transform a deterministic neural network weather forecasting system into an ensemble forecasting system. We test four methods to generate the ensemble: random initial perturbations, retraining of the neural network, use of random dropout in the network, and the creation of initial perturbations with singular vector decomposition. The latter method is widely used in numerical weather prediction models, but is yet to be tested on neural networks. The ensemble mean forecasts obtained from these four approaches all beat the unperturbed neural network forecasts, with the retraining method yielding the highest improvement. However, the skill of the neural network forecasts is systematically lower than that of state-of-the-art numerical weather prediction models.",2021,2021/12/3 13:09,2021/12/3 13:09,2021/12/3 13:09,,,2,13,,,,,,,,,,en,,,,,Wiley Online Library,,_eprint: https://onlinelibrary.wiley.com/doi/pdf/10.1029/2020MS002331,,/Users/bbochenek/Zotero/storage/RY53NQS7/Scher i Messori - 2021 - Ensemble Methods for Neural Network-Based Weather .pdf,,,ensemble forecasting; machine learning; neural networks; singular value decomposition; weather forecasting,,,,,,,,,,,,,,,,,,,,,,,,,,,,,,,,,,,,,,,,,,,,,,
YFTS4NHJ,book,2020,,Geometric deep learning for medium-range weather prediction,,,,,,"Medium-range numerical weather prediction (NWP) is crucial to human activities. Reliable weather forecasts allow better resource management and are essential for disaster preparation. Modern NWP models provide accurate medium-range forecasts, but they require some of the largest computing facilities currently available. Convolutional Neural Networks (CNNs) are data-driven architectures preserving the spatial relationship of data with a low number of learnable parameters, thus having the potential to relieve this computational cost. As CNNs were originally tailored for Euclidean domains, current data-driven NWP approaches are based on planar projections of the sphere, which induces important deformations. This work proposes a data-driven medium-range NWP approach using a CNN able to perform convolutions natively on the sphere and integrating the temporal dimension. The effect of static and dynamic atmospheric features, as well as of the temporal discretization, is tested on the predictive skill using a wide range of metrics. Experimental results show that our method is able to emulate complex patterns of common atmospheric fields, and that our predictions are able to accurately reproduce the seasonal cycle. Our model outperforms the global and weekly climatologies and the persistence baselines up to 5 days. In addition, our model produces state-of-the-art temperature predictions for short forecast lead times",2020,2021/12/3 13:11,2021/12/3 13:11,,,33,,,,,,,,,,,,,,,,,Infoscience,,,,,,,,"Llorens Jover, Iciar",,,,,,,,,,,,,,,,,,,,,,,,,,,,,,,,,,,,,,,,,,,,,
TPDHWPCS,bookSection,2021,"Umer, Muhammad Azmi; Jilani, Muhammad Taha; Junejo, Khurum Nazir; Naz, Sulaman Ahmad; D’Silva, Conrad Walter",Role of Machine Learning in Weather Related Event Predictions for a Smart City,Machine Intelligence and Data Analytics for Sustainable Future Smart Cities,978-3-030-72065-0,,,https://doi.org/10.1007/978-3-030-72065-0_4,"Weather related event prediction is always a fascinating problem for scientists due to its importance in different sectors of life. This chapter has used machine learning algorithms to predict events like rainfall, thunderstorm, and fog in a large metropolitan city. The study proposed here has particularly focused on the long-term event predictions which is currently missing in the state of the artwork. Different machine learning algorithms mainly Random Forest, Gradient Boosting Classifier, Logistic Regression, and others were used to learn the model. Five years of meteorological data was used for this purpose. Different algorithms showed accuracy more than 90%, among which Random Forest outperformed the other algorithms by achieving the highest accuracy.",2021,2021/12/3 13:11,2021/12/3 13:11,2021/12/3 13:11,49-63,,,,,,,Studies in Computational Intelligence,,,,Springer International Publishing,Cham,en,,,,,Springer Link,,DOI: 10.1007/978-3-030-72065-0_4,,,,,,"Ghosh, Uttam; Maleh, Yassine; Alazab, Mamoun; Pathan, Al-Sakib Khan",,,,,,,,,,,,,,,,,,,,,,,,,,,,,,,,,,,,,,,,,,,,,
3CFUNUYT,journalArticle,2021,"Zhou, Yong; Liu, Yanfeng; Wang, Dengjia; Liu, Xiaojun; Wang, Yingying",A review on global solar radiation prediction with machine learning models in a comprehensive perspective,Energy Conversion and Management,,0196-8904,10.1016/j.enconman.2021.113960,https://www.sciencedirect.com/science/article/pii/S0196890421001369,"Global solar radiation information is the basis for many solar energy utilizations as well as for economic and environmental considerations. However, because solar-radiation changes, and measurements are sometimes not available, accurate global solar-radiation data are often difficult or impossible to obtain. Machine-learning models, on the other hand, are capable of conducting highly nonlinear problems. They have many potential applications and are of high interest to researchers worldwide. Based on 232 paper regarding to the machine-learning models for global solar radiation prediction, this paper provides a comprehensive and systematic review of all important aspects surrounding machine-learning models, including input parameters, feature selection and model development. The pros and cons of three input-parameter sources (observation data from a surface meteorological observation station, satellite-based data, numerical weather-predicting re-analyzed data) and three feature selection methods (filter, wrapped, embedded) are reviewed and analyzed in this paper. Using data pre-processing algorithms, output ensemble methods, and model purposes, seven classes of machine-learning models are identified and reviewed. Finally, the state of current and future research on machine-learning models to forecast the global solar radiation are discussed. This paper provides a compact guide of existing model modification and novel model development regarding predicting global solar radiation.",2021/5/1,2021/12/3 13:12,2021/12/3 13:12,2021/12/3 13:12,113960,,,235,,Energy Conversion and Management,,,,,,,,en,,,,,ScienceDirect,,,,,,,Feature selection; Global solar radiation; Input parameters; Machine-learning model; Predictive modelling,,,,,,,,,,,,,,,,,,,,,,,,,,,,,,,,,,,,,,,,,,,,,,
E2AU2LDJ,journalArticle,2018,"Fouilloy, Alexis; Voyant, Cyril; Notton, Gilles; Motte, Fabrice; Paoli, Christophe; Nivet, Marie-Laure; Guillot, Emmanuel; Duchaud, Jean-Laurent",Solar irradiation prediction with machine learning: Forecasting models selection method depending on weather variability,Energy,,0360-5442,10.1016/j.energy.2018.09.116,https://www.sciencedirect.com/science/article/pii/S0360544218318802,"Eleven statistical and machine learning tools are analyzed and applied to hourly solar irradiation forecasting for time horizon from 1 to 6 h. A methodology is presented to select the best and most reliable forecasting model according to the meteorological variability of the site. To make the conclusions more universal, solar data collected in three sites with low, medium and high meteorological variabilities are used: Ajaccio, Tilos and Odeillo. The datasets variability is evaluated using the mean absolute log return value. The models were compared in term of normalized root mean square error, mean absolute error and skill score. The most efficient models are selected for each variability and temporal horizon: for the weak variability, auto-regressive moving average and multi-layer perceptron are the most efficient, for a medium variability, auto-regressive moving average and bagged regression tree are the best predictors and for a high one, only more complex methods can be used efficiently, bagged regression tree and the random forest approach.",2018/12/15,2021/12/3 13:12,2021/12/3 13:12,2021/12/3 13:12,620-629,,,165,,Energy,Solar irradiation prediction with machine learning,,,,,,,en,,,,,ScienceDirect,,,,/Users/bbochenek/Zotero/storage/7S79AZ4U/Fouilloy et al. - 2018 - Solar irradiation prediction with machine learning.pdf,,,ANN; ARMA; Gaussian process; Machine learning; Regression tree; SVR; Time series forecasting; Variability,,,,,,,,,,,,,,,,,,,,,,,,,,,,,,,,,,,,,,,,,,,,,,
QP24GEA2,journalArticle,2018,"Hoolohan, Victoria; Tomlin, Alison S.; Cockerill, Timothy",Improved near surface wind speed predictions using Gaussian process regression combined with numerical weather predictions and observed meteorological data,Renewable Energy,,0960-1481,10.1016/j.renene.2018.04.019,https://www.sciencedirect.com/science/article/pii/S0960148118304269,"This study presents a hybrid numerical weather prediction model (NWP) and a Gaussian process regression (GPR) model for near surface wind speed prediction up to 72 h ahead using data partitioned on atmospheric stability class to improve model performance. NWP wind speed data from the UK meteorological office was corrected using a GPR model, where the data was subdivided using the atmospheric stability class calculated using the Pasquill-Gifford-Turner method based on observations at the time of prediction. The method was validated using data from 15 UK MIDAS (Met office Integrated Data Archive System) sites with a 9 month training and 3 month test period. Results are also shown for hub height wind speed prediction at one turbine. Additionally, power output is predicted for this turbine by translating hub height wind speed to power using a turbine power curve. While various forecasting methods exist, limited methods consider the impact of atmospheric stability on prediction accuracy. Therefore the method presented in this study gives a new way to improve wind speed predictions. Outputs show the GPR model improves forecast accuracy over the original NWP data, and consideration of atmospheric stability further reduces prediction errors. Comparing predicted power output to measured output reveals power predictions are also enhanced, demonstrating the potential of this novel wind speed prediction technique.",2018/10/1,2021/12/3 13:12,2021/12/3 13:12,2021/12/3 13:12,1043-1054,,,126,,Renewable Energy,,,,,,,,en,,,,,ScienceDirect,,,,/Users/bbochenek/Zotero/storage/K9I6EAJI/Hoolohan et al. - 2018 - Improved near surface wind speed predictions using.pdf,,,Atmospheric stability; Gaussian process regression; Wind speed prediction,,,,,,,,,,,,,,,,,,,,,,,,,,,,,,,,,,,,,,,,,,,,,,
WXU8HLHD,journalArticle,2018,"Čiurlionis, Aivaras; Lukoševičius, Mantas",Nowcasting precipitation using weather radar data for Lithuania: the first results,"CEUR workshop proceedings: System 2018: Symposium for young scientists in technology, engineering and mathematics: proceedings of the symposium for young scientists in technology, engineering and mathematics, Gliwice, Poland, May 28, 2018.",,1613-0073,,https://epubl.ktu.edu/object/elaba:30524178/,"Although the accuracy and the duration of modern weather forecasts constantly increase together, numerical weather prediction methods still face a few drawbacks. Due to an extensive computing time and a high power usage, these methods are unable to efficiently react to rapidly changing initial weather conditions. Also, most of the numerical weather prediction models can be less accurate for smaller regions with specific local weather conditions. These problems are addressed by a technique called nowcasting, which uses an extrapolation of various current weather conditions. Multiple research papers have shown that this technique can outperform traditional weather predictions for up to two hours. Furthermore, it can be improved using machine learning algorithms. In this paper nowcasting algorithms are used to predict a short-term precipitation over Lithuania using weather radar images provided by Lithuanian Hydrometeorology service. A Hanssen-Kuipers score is used to evaluate the accuracy of prediction against observed precipitation maps. The results of three extrapolation algorithms (basic translation, step translation, and sequence translation) and a single machine learning algorithm based on convolutional neural networks (CNN) are evaluated for two chosen hours and compared to the persistency algorithm. The average scores of each prediction algorithm for a single week are also presented. Although the results remain accurate for up to 45 minutes only, the accuracy can be improved by adding additional variables to the extrapolation. The better accuracy can also be achieved by using more sophisticated machine learning algorithms, like recurrent neural networks and their variations, that take dependencies on previous inputs in time series into account. This paper presents the first results of the algorithms, which are to be improved by further research.",2018,2021/12/3 13:13,2021/12/3 13:13,2021/12/3 13:13,55-60,,,2147,,,Nowcasting precipitation using weather radar data for Lithuania,,,,,,,eng,,,,,epubl.ktu.edu,,Publisher: CEUR-WS,,/Users/bbochenek/Zotero/storage/6YL69N3G/Čiurlionis i Lukoševičius - 2018 - Nowcasting precipitation using weather radar data .pdf,,,,,,,,,,,,,,,,,,,,,,,,,,,,,,,,,,,,,,,,,,,,,,,,,
5B33FGHG,conferencePaper,2019,"Hewage, Pradeep; Behera, Ardhendu; Trovati, Marcello; Pereira, Ella",Long-Short Term Memory for an Effective Short-Term Weather Forecasting Model Using Surface Weather Data,Artificial Intelligence Applications and Innovations,978-3-030-19823-7,,10.1007/978-3-030-19823-7_32,,"Numerical Weather Prediction (NWP) requires considerable computer power to solve complex mathematical equations to obtain a forecast based on current weather conditions. In this article, we propose a lightweight data-driven weather forecasting model by exploring state-of-the-art deep learning techniques based on Artificial Neural Network (ANN). Weather information is captured by time-series data and thus, we explore the latest Long Short-Term Memory (LSTM) layered model, which is a specialised form of Recurrent Neural Network (RNN) for weather prediction. The aim of this research is to develop and evaluate a short-term weather forecasting model using the LSTM and evaluate the accuracy compared to the well-established Weather Research and Forecasting (WRF) NWP model. The proposed deep model consists of stacked LSTM layers that uses surface weather parameters over a given period of time for weather forecasting. The model is experimented with different number of LSTM layers, optimisers, and learning rates and optimised for effective short-term weather predictions. Our experiment shows that the proposed lightweight model produces better results compared to the well-known and complex WRF model, demonstrating its potential for efficient and accurate short-term weather forecasting.",2019,2021/12/3 13:13,2021/12/3 13:13,,382-390,,,,,,,IFIP Advances in Information and Communication Technology,,,,Springer International Publishing,Cham,en,,,,,Springer Link,,,,/Users/bbochenek/Zotero/storage/RRFGYZN3/Hewage et al. - 2019 - Long-Short Term Memory for an Effective Short-Term.pdf,,,Long Short-Term Memory; Numerical Weather Prediction; Surface weather parameters; Time-series data analysis; WRF,"MacIntyre, John; Maglogiannis, Ilias; Iliadis, Lazaros; Pimenidis, Elias",,,,,,,,,,,,,,,,,,,,,,,,,,,,,,,,,,,,,,,,,,,,,
S3SWYIW4,conferencePaper,2020,"Gygax, Gregory; Schüle, Martin",A Hybrid Deep Learning Approach for Forecasting Air Temperature,Artificial Neural Networks in Pattern Recognition,978-3-030-58309-5,,10.1007/978-3-030-58309-5_19,,"Forecasting the weather is a great scientific challenge. Physics-based, numerical weather prediction (NWP) models have been developed for decades by large research teams and the accuracy of forecasts has been steadily increased. Yet, recently, more and more data-driven machine learning approaches to weather forecasting are being developed. In this contribution we aim to develop an approach that combines the advantages of both methodologies, that is, we develop a deep learning model to predict air temperature that is trained both on NWP models and local weather data. We evaluate the approach for 249 weather station sites in Switzerland and find that the model outperfoms the NWP models on short time-scales and in some geographically distinct regions of Switzerland.",2020,2021/12/3 13:13,2021/12/3 13:13,,235-246,,,,,,,Lecture Notes in Computer Science,,,,Springer International Publishing,Cham,en,,,,,Springer Link,,,,,,,Deep learning; Hybrid modeling; Weather forecasting,"Schilling, Frank-Peter; Stadelmann, Thilo",,,,,,,,,,,,,,,,,,,,,,,,,,,,,,,,,,,,,,,,,,,,,
4JNC5C94,journalArticle,2021,"Yemane, Suzan",Deep forecasting of renewable energy production with numerical weather predictions,,,,,https://lutpub.lut.fi/handle/10024/162797,"Renewable energy is used in many countries with numerous health, environmental and economic benefits. Forecasting renewable energy production helps to predict future energy produced in order to achieve demand and supply balance. This thesis focuses on a deep learning method for forecasting renewable energy production from photovoltaic panels using weather data to improve the predictions. The main focus of this thesis is forecasting photovoltaic production and investigating if the prediction performance could be improved by using numerical weather prediction over a 36-hour prediction horizon using a state-of-the-art probabilistic forecasting model, probabilistic forecasting with autoregressive recurrent networks. The forecasting result of photovoltaic production with weather data prediction shows a slight improvement. The forecasting performance of the selected model is also compared with benchmark models i.e., naïve predictor, seasonal naive predictor, and constant predictor.",2021,2021/12/3 13:13,2021/12/3 13:13,2021/12/3 13:13,,,,,,,,,,,,,,eng,fi=Kaikki oikeudet pidätetään.|en=All rights reserved.|,,,,lutpub.lut.fi,,Accepted: 2021-06-02T07:59:21Z,,/Users/bbochenek/Zotero/storage/ALBP7EN2/Yemane - 2021 - Deep forecasting of renewable energy production wi.pdf,,,,,,,,,,,,,,,,,,,,,,,,,,,,,,,,,,,,,,,,,,,,,,,,,
