Key,Item Type,Publication Year,Author,Title,Publication Title,ISBN,ISSN,DOI,Url,Abstract Note,Date,Date Added,Date Modified,Access Date,Pages,Num Pages,Issue,Volume,Number Of Volumes,Journal Abbreviation,Short Title,Series,Series Number,Series Text,Series Title,Publisher,Place,Language,Rights,Type,Archive,Archive Location,Library Catalog,Call Number,Extra,Notes,File Attachments,Link Attachments,Manual Tags,Automatic Tags,Editor,Series Editor,Translator,Contributor,Attorney Agent,Book Author,Cast Member,Commenter,Composer,Cosponsor,Counsel,Interviewer,Producer,Recipient,Reviewed Author,Scriptwriter,Words By,Guest,Number,Edition,Running Time,Scale,Medium,Artwork Size,Filing Date,Application Number,Assignee,Issuing Authority,Country,Meeting Name,Conference Name,Court,References,Reporter,Legal Status,Priority Numbers,Programming Language,Version,System,Code,Code Number,Section,Session,Committee,History,Legislative Body
SD9BJ5WK,journalArticle,2021,"Schulz, Benedikt; El Ayari, Mehrez; Lerch, Sebastian; Baran, Sándor",Post-processing numerical weather prediction ensembles for probabilistic solar irradiance forecasting,Solar Energy,,0038-092X,10.1016/j.solener.2021.03.023,https://www.sciencedirect.com/science/article/pii/S0038092X21002097,"In order to enable the transition towards renewable energy sources, probabilistic energy forecasting is of critical importance for incorporating volatile power sources such as solar energy into the electrical grid. Solar energy forecasting methods often aim to provide probabilistic predictions of solar irradiance. In particular, many hybrid approaches combine physical information from numerical weather prediction models with statistical methods. Even though the physical models can provide useful information at intra-day and day-ahead forecast horizons, ensemble weather forecasts from multiple model runs are often not calibrated and show systematic biases. We propose a post-processing model for ensemble weather predictions of solar irradiance at temporal resolutions between 30 min and 6 h. The proposed models provide probabilistic forecasts in the form of a censored logistic probability distribution for lead times up to 5 days and are evaluated in two case studies covering distinct physical models, geographical regions, temporal resolutions, and types of solar irradiance. We find that post-processing consistently and significantly improves the forecast performance of the ensemble predictions for lead times up to at least 48 h and is well able to correct the systematic lack of calibration.",2021/5/15,2021/10/6 14:08,2021/10/6 14:08,2021/10/6 14:08,1016-1031,,,220,,Solar Energy,,,,,,,,en,,,,,ScienceDirect,,,,/Users/bbochenek/Zotero/storage/PZB6EJA2/Schulz et al. - 2021 - Post-processing numerical weather prediction ensem.pdf,,,Solar irradiance; Energy forecasting; Ensemble model output statistics; Ensemble post-processing; Probabilistic forecasting; Solar energy,,,,,,,,,,,,,,,,,,,,,,,,,,,,,,,,,,,,,,,,,,,,,,
66ZD8I7S,journalArticle,2020,"Sønderby, Casper Kaae; Espeholt, Lasse; Heek, Jonathan; Dehghani, Mostafa; Oliver, Avital; Salimans, Tim; Agrawal, Shreya; Hickey, Jason; Kalchbrenner, Nal",MetNet: A Neural Weather Model for Precipitation Forecasting,"arXiv:2003.12140 [physics, stat]",,,,http://arxiv.org/abs/2003.12140,"Weather forecasting is a long standing scientific challenge with direct social and economic impact. The task is suitable for deep neural networks due to vast amounts of continuously collected data and a rich spatial and temporal structure that presents long range dependencies. We introduce MetNet, a neural network that forecasts precipitation up to 8 hours into the future at the high spatial resolution of 1 km$^2$ and at the temporal resolution of 2 minutes with a latency in the order of seconds. MetNet takes as input radar and satellite data and forecast lead time and produces a probabilistic precipitation map. The architecture uses axial self-attention to aggregate the global context from a large input patch corresponding to a million square kilometers. We evaluate the performance of MetNet at various precipitation thresholds and find that MetNet outperforms Numerical Weather Prediction at forecasts of up to 7 to 8 hours on the scale of the continental United States.",2020/3/30,2021/10/6 14:09,2021/10/6 14:09,2021/10/6 14:09,,,,,,,MetNet,,,,,,,,,,,,arXiv.org,,arXiv: 2003.12140,,/Users/bbochenek/Zotero/storage/KGFTIBN6/Sønderby et al. - 2020 - MetNet A Neural Weather Model for Precipitation F.pdf; /Users/bbochenek/Zotero/storage/P57VLUY9/2003.html,,,Computer Science - Machine Learning; Physics - Atmospheric and Oceanic Physics; Statistics - Machine Learning,,,,,,,,,,,,,,,,,,,,,,,,,,,,,,,,,,,,,,,,,,,,,,
KM9SYW8U,journalArticle,2019,"Czernecki, Bartosz; Taszarek, Mateusz; Marosz, Michał; Półrolniczak, Marek; Kolendowicz, Leszek; Wyszogrodzki, Andrzej; Szturc, Jan","Application of machine learning to large hail prediction - The importance of radar reflectivity, lightning occurrence and convective parameters derived from ERA5",Atmospheric Research,,0169-8095,10.1016/j.atmosres.2019.05.010,https://www.sciencedirect.com/science/article/pii/S0169809519300900,"This study presents a concept for coupling remote sensing data and environmental variables with machine learning techniques for the prediction of large hail events. In particular, we want to address the following question: How would one improve the performance of large hail warnings / forecasts if thermodynamic and kinematic parameters derived from a numerical weather prediction model are combined with real-time remote sensing data? For this purpose, POLRAD radar reflectivity, EUCLID lightning detection data, and convective indices calculated from the ERA5 reanalysis are combined and then compared with large hail reports from Poland (2008–2017). The data fusion of multiple sources, coupled with the machine learning approach, makes it possible to greatly improve the robustness of large hail prediction compared to any single product commonly used in operational forecasting. This is especially noticeable with the reduced number of false alarms. Although the created machine learning models are mainly driven by radar reflectivity, composite thermodynamic and kinematic indices such as Hail Size Index (HSI), Significant Hail Parameter (SHIP), Large Hail Parameter (LGHAIL), and WMAXSHEAR provide an added value to a model's performance. The accuracy achieved by a random forest model brings with it encouraging prospects for future research with respect to operational forecasters (who may fill in the gaps within NWP-derived data with remotely sensed measurement) and climatological studies that aim to investigate past and future changes in severe weather occurrences.",2019/10/1,2021/10/6 14:09,2021/10/6 14:09,2021/10/6 14:09,249-262,,,227,,Atmospheric Research,,,,,,,,en,,,,,ScienceDirect,,,,/Users/bbochenek/Zotero/storage/ISSAFDBC/S0169809519300900.html,,,Machine learning; Forecasting; ERA5; ESWD; EUCLID; Large hail; Thunderstorm,,,,,,,,,,,,,,,,,,,,,,,,,,,,,,,,,,,,,,,,,,,,,,
JSTTUS3M,journalArticle,2019,"O'Gorman, P. A.; Yuval, J.",Machine learning for parameterization of subgrid processes in the atmosphere,,,,,https://ui.adsabs.harvard.edu/abs/2019AGUFM.A43E..07O,"The parameterization of subgrid processes such as deep convection contributes to uncertainty in climate modeling and numerical weather prediction. Machine learning can be used to learn new parameterizations directly from high-resolution model output, but the resulting parameterizations do not always lead to stable and accurate simulations when implemented in a coarse-resolution model. Previous work suggests that a machine learning approach based on an ensemble of decision trees (random forest) can be used to robustly emulate a conventional moist convection scheme. Here we use this decision-tree approach to learn a parameterization from coarse-grained output of a quasi-global high-resolution model with hypohydostatic rescaling. We discuss the performance of the parameterization when implemented at coarse resolution in the same model with a focus on statistics of mean and extreme precipitation. In addition, we discuss approaches to improve generalization across climates and to provide insights into the underlying dynamics.",2019/12/1,2021/10/6 14:09,2021/10/6 14:09,2021/10/6 14:09,A43E-07,,,2019,,,,,,,,,,,,,,,NASA ADS,,Conference Name: AGU Fall Meeting Abstracts ADS Bibcode: 2019AGUFM.A43E..07O,,,,,1942 Machine learning; INFORMATICS; ATMOSPHERIC PROCESSES; 3337 Global climate models; 3305 Climate change and variability; 3365 Subgrid-scale (SGS) parameterization,,,,,,,,,,,,,,,,,,,,,,,,,,,,,,,,,,,,,,,,,,,,,,
YSZ8CRXM,journalArticle,2019,"Lee, H.; Kim, S. H.; Cha, E., , Dr; Jung, J. Mr",Detection of tropical cyclone genesis through machine learning,,,,,https://ui.adsabs.harvard.edu/abs/2019AGUFM.A23V2988L,"One of the most challenging tasks in numerical weather prediction is the capability of predicting Tropical Cyclone (TC) genesis. Recent studies show that machine learning algorithms used to predict TC genesis in the world. In this study, TC positions in the western North Pacific (WNP) are grouped into two clusters by the K-means clustering algorithm. An initial selection of dynamic and thermodynamic variables for TC genesis is based on correlation coefficient. The decision tree algorithm in each cluster shows the relative importance of potential variables, determines the thresholds of each variable, and creates rules for the tropical disturbance that are most likely to develop into a TC. To verify the accuracy of this decision tree in classifying developing and nondeveloping disturbances, both 10-fold cross validation and hindcast analyses for the 2016-2018 are conducted. The results from this hindcast accuracy are expected to construct a decision tree model that is applied to individual disturbances to predict TC genesis at 24-48h lead time.",2019/12/1,2021/10/6 14:09,2021/10/6 14:09,2021/10/6 14:09,A23V-2988,,,2019,,,,,,,,,,,,,,,NASA ADS,,Conference Name: AGU Fall Meeting Abstracts ADS Bibcode: 2019AGUFM.A23V2988L,,,,,4313 Extreme events; NATURAL HAZARDS; ATMOSPHERIC PROCESSES; 0360 Radiation: transmission and scattering; ATMOSPHERIC COMPOSITION AND STRUCTURE; 0315 Biosphere/atmosphere interactions; 3372 Tropical cyclones,,,,,,,,,,,,,,,,,,,,,,,,,,,,,,,,,,,,,,,,,,,,,,
M6GMGGCV,webpage,,,EBSCOhost | 140483659 | Using machine learning to estimate Inertia-Gravity Waves properties from a coarse-grained description of the flow.,,,,,https://web.a.ebscohost.com/abstract?direct=true&profile=ehost&scope=site&authtype=crawler&jrnl=10297006&AN=140483659&h=YB%2fCjXbDv4SF48Bbvz4UJ%2fs%2bPr2eGBWNV7R6Hk2FhU2n%2blC0PXmmg%2f0XSyPOmN06iVEHAHpo%2buTu6tsB0ccmYA%3d%3d&crl=c&resultNs=AdminWebAuth&resultLocal=ErrCrlNotAuth&crlhashurl=login.aspx%3fdirect%3dtrue%26profile%3dehost%26scope%3dsite%26authtype%3dcrawler%26jrnl%3d10297006%26AN%3d140483659,"This survey explores the use of machine learning to estimate a subgrid process from knowledge of a coarse-grained description of the flow in the troposphere. The process studied is atmospheric gravity waves which need to be parameterized in climate models. In these parameterizations, an essential yet poorly constrained component is the launch spectrum of non-orographic waves in the troposphere or lowermost stratosphere. We make use of the fact that current Numerical Weather Prediction models, with a spatial resolution of only a few tens of kilometers, describe well the variations of the gravity wave field, although it remains only partly unresolved (Jewtoukoff et al 2015). Hence the ERA5 reanalyses at full resolution provide us knowledge of the subgrid-scale process to estimate (the target): gravity waves at 100 hPa, quantified by the variance of vertical velocity or the associated momentum fluxes. We employ a 5-month data-set (May to September 2018), for a mid-latitude region of the Indian Ocean far from land masses and orographic obstacles. Explanatory variables are Low-resolution ERA5 data (2.5°×2.5°) through the troposphere (from 1000 to 100 hPa) including wind speed, relative vorticity, temperature gradients, and the Fraction of Cloud cover. As a first exploration of the capacity to reconstruct information on gravity waves from a low-resolution description of the tropospheric flow, we have used Random Forests as a non-parametric statistical model which readily provides information on the relative importance of the different explanatory variables. The statistical model is trained and tested using 10-fold cross-validation. The gravity wave diagnostics are reconstructed from knowledge of the tropospheric flow with promising agreement: correlation coefficients between the target and the reconstructed time-series are 0.7 or better. We also performed another examination to train the model over the Indian Ocean and test it on another area over Indian and Southern Pacific Oceans. The statistical evaluation shows reasonable results again. This exploration provides insights for the development of gravity wave parameterizations: first, it indicates a lower bound on how much of the gravity wave signal can be reconstructed, given the low-resolution information on the tropospheric flow. Second, it ranks the tropospheric variables by order of relevance, revealing notably the importance of upper-level winds.",,2021/10/6 14:09,2021/10/6 14:10,2021/10/6 14:09,,,,,,,,,,,,,,,,,,,,,,,/Users/bbochenek/Zotero/storage/B35SNEIV/abstract.html,,,,,,,,,,,,,,,,,,,,,,,,,,,,,,,,,,,,,,,,,,,,,,,,,
LRKIEHSU,report,2021,"Keany, Eoghan; Bessardon, Geoffrey; Gleeson, Emily",Leveraging machine learning to produce a cost-effective national building height map of Ireland,,,,,https://meetingorganizer.copernicus.org/EMS2021/EMS2021-48.html,"To represent surface thermal, turbulent and humidity exchanges, Numerical Weather Prediction (NWP) systems require a land-cover classification map to calculate sur-face parameters used in surface flux estimation. The latest land-cover classification map used in the HARMONIE-AROME configuration of the shared ALADIN-HIRLAMNWP system for operational weather forecasting is ECOCLIMAP-SG (ECO-SG). The first evaluation of ECO-SG over Ireland suggested that sparse urban areas are underestimated and instead appear as vegetation areas (1). While the work of (2) on land-cover classification helps to correct the horizontal extent of urban areas, the method does not provide information on the vertical characteristics of urban areas. ECO-SG urban classification implicitly includes building heights (3), and any improvement to ECO-SG urban area extent requires a complementary building height dataset. Openly accessible building height data at a national scale does not exist for the island of Ireland. This work seeks to address this gap in availability by extrapolating the preexisting localised building height data across the entire island. The study utilises information from both the temporal and spatial dimensions by creating band-wise temporal aggregation statistics from morphological operations, for both the Sentinel-1A/B and Sentinel-2A/B constellations (4). The extrapolation uses building height information from the Copernicus Urban Atlas, which contains regional coverage for Dublin at 10 m x10 m resolution (5). Various regression models were then trained on these aggregated statistics to make pixel-wise building height estimates. These model estimates were then evaluated with an adjusted RMSE metric, with the most accurate model chosen to map the entire country. This method relies solely on freely available satellite imagery and open-source software, providing a cost-effective mapping service at a national scale that can be updated more frequently, unlike expensive once-off private mapping services. Furthermore, this process could be applied by these services to reduce costs by taking a small representative sample and extrapolating the rest of the area. This method can be applied beyond national borders providing a uniform map that does not depends on the different private service practices facilitating the updates of global or continental land-cover information used in NWP.",2021/6/18,2021/10/6 14:10,2021/10/6 14:10,2021/10/6 14:10,,,,,,,,,,,,Copernicus Meetings,,en,,,,,meetingorganizer.copernicus.org,,Conference Name: EMS2021 DOI: 10.5194/ems2021-48,,/Users/bbochenek/Zotero/storage/IDS6PUAD/Keany et al. - 2021 - Leveraging machine learning to produce a cost-effe.pdf; /Users/bbochenek/Zotero/storage/FGEWEAED/EMS2021-48.html,,,,,,,,,,,,,,,,,,,,,,EMS2021-48,,,,,,,,,,,,,,,,,,,,,,,,,,,
EG55UAKC,journalArticle,2018,"Verbois, Hadrien; Huva, Robert; Rusydi, Andrivo; Walsh, Wilfred",Solar irradiance forecasting in the tropics using numerical weather prediction and statistical learning,Solar Energy,,0038-092X,10.1016/j.solener.2018.01.007,https://www.sciencedirect.com/science/article/pii/S0038092X18300197,"Increasing penetration of distributed renewable power means that reliable generation forecasts are required for grid operation. The present work aims at combining state of the art implementations of the Weather Research and Forecasting (WRF) model with multivariate statistical learning techniques to provide the most accurate forecasts of day-ahead hourly irradiance in Singapore. Three implementations of WRF-including WRF-solar-were used to produce three years of hourly day-ahead irradiance forecasts. Their performances were compared with that of the Global Forecasting System (GFS), which was interpolated to provide hourly forecasts. A multivariate post-processing procedure combining Principal Component Analysis (PCA) and stepwise variable selection was developed and applied to the four models. A smart persistence model and a climatological forecast were also implemented and served as benchmarks. The skill of the various models were evaluated using several metrics and statistical tests. We found that WRF-solar combined with our proposed statistical learning method outperformed smart persistence, a climatological forecast and GFS for day-ahead forecasts of irradiance. In particular, our model was shown to have a Root Mean Square Error (RMSE) 23% lower than smart persistence.",2018/3/1,2021/10/6 14:10,2021/10/6 14:10,2021/10/6 14:10,265-277,,,162,,Solar Energy,,,,,,,,en,,,,,ScienceDirect,,,,,,,,,,,,,,,,,,,,,,,,,,,,,,,,,,,,,,,,,,,,,,,,,,,,,
X4RSQMHK,journalArticle,2021,"Asha, P.; Jesudoss, A.; Mary, S. Prince; Sandeep, K. V. Sai; Vardhan, K. Harsha",An Efficient Hybrid Machine Learning Classifier for Rainfall Prediction,Journal of Physics: Conference Series,,1742-6596,10.1088/1742-6596/1770/1/012012,https://doi.org/10.1088/1742-6596/1770/1/012012,"The most leading applications of Artificial Intelligence that seems to witness an immense Progression in the digital era are the Machine Learning (ML) Techniques. It learns itself from the past experiences and attempts at the best prediction of future instances or trends. Such progressive learning does not demand any explicit programming structures. Machine learning finds a wide range of application areas, and out of which accurate real time weather prediction gains importance. An interactive neural network based classification model for better prediction of rainfall has been put forth in this paper; we have proposed an interactive model for predicting rainfall using neural classification. The model is premeditated in a way, that it fetches feature extraction from a database including information about previous rainfalls in a specific area. The features were then pre-processed and further segmented by employing the random forest. The segmented outputs are then classified using neural networks. A comparison of spatial interpolation scheme is done with existing systems by deploying the hybrid classifier. The efficiency of the proposed model is evaluated and is compared with the traditional Deep Learning process and it is observed that the Random forest based interactive model provides better performance. Results of the model seem to be more accurate as the model uses an iterative approach for feature extraction.",3月-21,2021/10/6 14:10,2021/10/6 14:10,2021/10/6 14:10,12012,,1,1770,,J. Phys.: Conf. Ser.,,,,,,,,en,,,,,Institute of Physics,,Publisher: IOP Publishing,,/Users/bbochenek/Zotero/storage/FAU8VQ4I/Asha et al. - 2021 - An Efficient Hybrid Machine Learning Classifier fo.pdf,,,,,,,,,,,,,,,,,,,,,,,,,,,,,,,,,,,,,,,,,,,,,,,,,
XXZVBD3V,journalArticle,2020,"Scheck, L.; Baur, F.",A machine learning based forward operator for visible and near-infrared satellite images,,,,,https://ui.adsabs.harvard.edu/abs/2020AGUFMA059.0004S,"Visible and near-infrared satellite observations from geostationary satellite provide high-resolution information on clouds and aerosols. To use this information for data assimilation and for the evaluation of numerical weather prediction models, sufficiently fast and accurate forward operators are required, which compute synthetic satellite images from the model state. At these wavelengths, scattering is important, which makes radiative transfer methods complicated and computationally expensive. Only recently, a fast method for visible images has become available, which is based on a compressed eight-dimensional reflectance look-up table computed with a much slower standard radiative transfer method. While the usefulness of this operator has been demonstrated, it is restricted to clouds and non-absorbing channels. Taking aerosols and additional effects like absorption by water vapor into account with the same approach is not very practical, as it would require additional dimensions and thus a strongly increased table size. Here we report on using feed-forward neural networks as an alternative to the look-up table and demonstrate that it is possible to achieve a comparable speed and accuracy. The amount of training data and the memory required by the operator can be reduced by orders of magnitude, which makes additional input dimensions feasible. Moreover, the neural-network approach has an advantage for variational or hybrid data assimilation systems: Tangent-linear and adjoint versions of the neural network inference code can easily be derived for arbitrary network structures and do not have to be changed when the network is trained with different data.",2020/12/1,2021/10/6 14:11,2021/10/6 14:11,2021/10/6 14:11,A059-0004,,,2020,,,,,,,,,,,,,,,NASA ADS,,Conference Name: AGU Fall Meeting Abstracts ADS Bibcode: 2020AGUFMA059.0004S,,,,,INFORMATICS; ATMOSPHERIC PROCESSES; 3311 Clouds and aerosols; 1906 Computational models; 1914 Data mining; 1922 Forecasting; algorithms,,,,,,,,,,,,,,,,,,,,,,,,,,,,,,,,,,,,,,,,,,,,,,
J6KNMVHK,journalArticle,2018,"McCandless, T.; Gagne, D. J., II; Kosovic, B.; Haupt, S. E.; Brummet, T.",Machine Learning Parameterizations of Surface Layer Fluxes,,,,,https://ui.adsabs.harvard.edu/abs/2018AGUFMEP51E1867M,"Surface layer parameterizations in numerical weather prediction models provide an interface between the land surface model and the lowest levels of the atmospheric model through the calculation of momentum, sensible heat, and latent heat fluxes. Current surface layer parameterizations are based on Monin-Obukhov similarity theory, which links the near surface vertical profiles of wind, temperature, and moisture to their relevant fluxes through the use of empirical functions conditioned on the stability of the surface layer. While these empirical functions agree closely with observations under homogeneous conditions, there are many situations in which observed fluxes do not match the estimates from similarity theory. Therefore, the goal of this project is to train a diverse set of machine learning approaches on multi-year time series of surface layer and flux observations. We have acquired surface layer observations from meteorological towers in Cabauw, Netherlands, and Idaho, United States. We train random forests, gradient boosted regression, dense neural networks, and generative adversarial networks to predict friction velocity and the temperature and moisture turbulent scale terms. These terms can be used to derive the surface momentum, sensible heat, and latent heat fluxes as well as calculating stability diagnostics. We evaluate each machine learning model and identify the strengths and weaknesses of each method under different stability regimes and weather conditions for determining the surface momentum, sensible heat, and latent heat fluxes.",2018/12/1,2021/10/6 14:11,2021/10/6 14:11,2021/10/6 14:11,EP51E-1867,,,2018,,,,,,,,,,,,,,,NASA ADS,,Conference Name: AGU Fall Meeting Abstracts ADS Bibcode: 2018AGUFMEP51E1867M,,,,,1824 Geomorphology: general; HYDROLOGYDE: 1942 Machine learning; INFORMATICSDE: 4217 Coastal processes; OCEANOGRAPHY: GENERALDE: 4558 Sediment transport; OCEANOGRAPHY: PHYSICAL,,,,,,,,,,,,,,,,,,,,,,,,,,,,,,,,,,,,,,,,,,,,,,
